,Game,Controls,Difficulty,Getting Started,Reading,Navigation,Visual,Audio,Communication,Total,Summary,Rating,Genres,Platforms,Companies,Cover,Video
341,Do Not Feed the Monkeys,1.5,2.5,0.56,2.86,0.71,2.5,5.0,0.0,1.64,"Do Not Feed the Monkeys is a digital voyeur simulator: a narrative-driven game where you invade the privacy of dozens of strangers and witness their most intimate moments, while you struggle to keep up to date with paying the rent and putting some food on the table.

You are the newest member of the “The Primate Observation Club” -and of course it is not the wildlife conservation society the name would suggest. It is a front for a shadowy group that watches others through surveillance cameras and compromised webcams. Tired of your ramshackle apartment, dull existence and boring jobs, you’re accepted into the exclusive organization, so you can pry into the privacy of the “caged monkeys” as they go about their lives.

The game lets you to Browse social networks, wikis, websites, newspapers, online stores and chat lounges to gather information about the “monkeys” you are charged to spy. The club urges you to not interfere with those observed (to not “feed the monkeys”). But then, what will you do? Will you intercede in the name of justice? Sabotage their dreams? Or will you just sit idly by while the world burns? Whatever you do (or don’t do) will have consequences!",70.92809558405177,"['Puzzle', 'Simulator', 'Strategy', 'Adventure', 'Indie']","['Linux', 'PC (Microsoft Windows)', 'Mac', 'Android', 'iOS', 'PlayStation 4', 'Xbox One', 'Nintendo Switch']","['Fictiorama Studios', 'Badland Publishing', 'Alawar Premium', 'Alawar Entertainment, Inc']",//images.igdb.com/igdb/image/upload/t_cover_big/co28xk.jpg,https://www.youtube.com/watch?v=cSyLk-K3wqg
342,Dodgeball Academia,1.0,5.0,2.22,4.29,2.86,3.5,7.5,0.0,2.46,"A sports RPG game featuring rookie dodgeball student, Otto. Join Otto and an eclectic cast of characters as they train to dominate on and off the courts of the academia.",74.79550688853014,"['Role-playing (RPG)', 'Sport', 'Adventure', 'Indie', 'Arcade']","['PC (Microsoft Windows)', 'PlayStation 4', 'Xbox One', 'Nintendo Switch']","['Pocket Trap', 'Humble Games']",//images.igdb.com/igdb/image/upload/t_cover_big/co3h52.jpg,https://www.youtube.com/watch?v=3Fw6wFqY2Ss
343,Dodo Peak,0.5,0.0,0.56,2.14,0.71,1.0,0.0,0.0,0.74,"Play as a dodo bird to find and rescue your lost babies from a series of dangerous peaks. Maneuver them home while avoiding obstacles and enemies!

Dodo Peak is a throwback to the classic arcade platformers of the past with a modern twist. Collect coins, dodge sneaky snakes, avoid malevolent monkeys, grab power-ups for extra speed or super strength, and strive for the best time across a stunning variety of handcrafted islands.

As your pack grows, so does the challenge in bringing them home!",,"['Platform', 'Puzzle', 'Arcade']","['PC (Microsoft Windows)', 'iOS', 'Nintendo Switch']","['Screenwave Media', 'Moving Pieces']",//images.igdb.com/igdb/image/upload/t_cover_big/co38va.jpg,
344,Dogworld,0.25,0.0,0.56,0.71,0.0,0.5,0.0,0.0,0.33,"Shoot, jump, and slide your way through a ruined, mysterious, dog-filled world as you fight to save humanity from the clutches of a rogue AI named Daddy.",,"['Shooter', 'Platform', 'Adventure', 'Indie']","['PC (Microsoft Windows)', 'Nintendo Switch']",['Lateralis'],//images.igdb.com/igdb/image/upload/t_cover_big/co2pbl.jpg,https://www.youtube.com/watch?v=PFXW05-reMw
345,Doki Doki Literature Club,1.25,0.0,2.78,2.86,0.71,2.5,5.0,0.0,1.8,,,,,,,
346,Dome Keeper,2.75,5.0,1.67,2.86,2.86,3.0,10.0,1.25,2.87,"Dome Romantik has grown to become Dome Keeper with beautiful updated pixel art, atmospheric music and sound and more of everything. Defend your dome from wave after wave of hostile attacks in this roguelike survival miner. Use the time between each attack to dig beneath the surface in search of valuable resources. Use them carefully on powerful upgrades to help you stay alive and make it to the next world.",78.45913631283905,"['Tactical', 'Indie', 'Arcade']","['Linux', 'PC (Microsoft Windows)', 'Mac']","['Raw Fury', 'Bippinbits']",//images.igdb.com/igdb/image/upload/t_cover_big/co4tbs.jpg,https://www.youtube.com/watch?v=azE1zlQhevI
347,Don't Escape: 4 Days to Survive,1.5,0.0,5.0,4.29,1.43,1.5,5.0,0.0,2.3,"After scraping out a bleak existence in the post-apocalyptic wastelands, you thought you were prepared for anything. But now there’s no way to run. The choices you make determine how everything plays out in this classic point-and-click adventure.",70.0,"['Point-and-click', 'Puzzle', 'Adventure', 'Indie']","['PC (Microsoft Windows)', 'Mac']","['Armor Games Studios', 'Scriptwelder']",//images.igdb.com/igdb/image/upload/t_cover_big/co1l1t.jpg,https://www.youtube.com/watch?v=pd9u9knrnzU
348,Don't Starve,0.75,0.0,1.67,2.14,1.43,1.0,5.0,1.25,1.31,"Don’t Starve is an uncompromising wilderness survival game full of science and magic.

You play as Wilson, an intrepid Gentleman Scientist who has been trapped by a demon and transported to a mysterious wilderness world. Wilson must learn to exploit his environment and its inhabitants if he ever hopes to escape and find his way back home.

Enter a strange and unexplored world full of strange creatures, dangers, and surprises. Gather resources to craft items and structures that match your survival style. Play your way as you unravel the mysteries of this strange land.",75.8402072465551,"['Simulator', 'Adventure', 'Indie']","['Linux', 'PC (Microsoft Windows)', 'Mac', 'PlayStation 4', 'Xbox One', 'Nintendo Switch']",['Klei Entertainment'],//images.igdb.com/igdb/image/upload/t_cover_big/co1qqw.jpg,https://www.youtube.com/watch?v=N0QhvmisGWU
349,Donkey Kong Country Returns,0.75,2.5,1.11,2.86,0.71,1.5,7.5,0.0,1.39,"Under the influence of a group of evil Tikis, the animals of Donkey Kong Island have raided Donkey Kong's banana hoard and stolen his stash of bananas - and being an ape of large appetites he understandably wants them back. Good thing that you are along for the ride. With Donkey Kong Country Returns, Retro Studios brings Donkey Kong back to a banana and platforming hungry public in a new side-scrolling adventure with familiar characters and new levels that reignite the passion players had for the Super NES original and all things Donkey Kong.",82.90915641104618,"['Platform', 'Adventure']","['Wii', 'Wii U']","['Retro Studios', 'Nintendo']",//images.igdb.com/igdb/image/upload/t_cover_big/co1wf4.jpg,https://www.youtube.com/watch?v=TMhEs78Zix8
350,Donkey Kong Country: Tropical Freeze,0.5,2.5,0.56,2.14,0.71,1.0,0.0,0.0,0.82,"All the challenging ground-pounding, barrel-blasting, side-scrolling mine cart action from the Donkey Kong Country series is back along with a bushel of new game-play elements and features. And now, there are four playable characters! Dixie Kong is back to join the adventure as a playable character alongside Diddy Kong, and for the first time in Donkey Kong Country, bearded old hero Cranky Kong joins the adventure with his bouncy cane. Any of the three can buddy up with Donkey Kong, and each character offers a different gameplay experience. On their journey to reclaim Donkey Kong Island, Donkey Kong and his friends travel across five islands with a variety of stages that include underwater areas and frozen environments.",83.24566384981709,['Platform'],['Wii U'],"['Retro Studios', 'Nintendo']",//images.igdb.com/igdb/image/upload/t_cover_big/co1wf2.jpg,https://www.youtube.com/watch?v=DueE8vJXpo8
351,Doodle Jump,1.0,5.0,1.67,0.71,0.0,1.5,2.5,0.0,1.15,"In Doodle Jump, the aim is to guide a four-legged animal called ""The Doodler"" up a never-ending series of platforms without falling.",71.77731254436506,"['Platform', 'Arcade']","['Xbox 360', 'Nintendo DS', 'Android', 'Nintendo 3DS', 'iOS', 'Arcade', 'BlackBerry OS', 'Windows Phone', 'Leapster Explorer/LeadPad Explorer']",['Lima Sky'],//images.igdb.com/igdb/image/upload/t_cover_big/co228c.jpg,
352,Doom Eternal,2.5,5.0,3.33,3.57,3.57,2.0,5.0,1.25,2.87,Hell’s armies have invaded Earth. Become the Slayer in an epic single-player campaign to conquer demons across dimensions and stop the final destruction of humanity. The only thing they fear... is you.,85.186760526706,['Shooter'],"['PC (Microsoft Windows)', 'PlayStation 4', 'Xbox One', 'Nintendo Switch', 'PlayStation 5', 'Xbox Series X|S', 'Google Stadia']","['Panic Button Games', 'Bethesda Softworks', 'id Software']",//images.igdb.com/igdb/image/upload/t_cover_big/co3p5n.jpg,https://www.youtube.com/watch?v=kKrvQuhMydw
353,Dordogne,0.5,0.0,5.0,2.86,1.43,1.0,5.0,0.0,1.72,"Dordogne is a narrative adventure game in which you play as Mimi, a 32-year-old woman visiting the house of her recently deceased grandmother.

Dordogne is set both in the present and the past. In the present timeline, Mimi explores the rooms in her grandmother’s home. In the past timeline, you’ll help a 10-year-old Mimi explore Dordogne and complete her quests, affecting the present.

Along with the puzzles that both versions of Mimi will solve, you’ll collect photos, sounds, objects and words to create Mimi’s journal – keeping young Mimi’s memories of summers spent with her grandmother in Dordogne.",77.56032605547047,"['Adventure', 'Indie']","['PC (Microsoft Windows)', 'PlayStation 4', 'Xbox One', 'Nintendo Switch', 'PlayStation 5', 'Xbox Series X|S']","['Un Je Ne Sais Quoi', 'Focus Entertainment']",//images.igdb.com/igdb/image/upload/t_cover_big/co6mcw.jpg,https://www.youtube.com/watch?v=a1JhKnaLxN0
354,Dorfromantik,1.25,0.0,2.22,2.14,0.71,2.0,5.0,0.0,1.56,"Dorfromantik is a peaceful building strategy and puzzle game where you create a beautiful and ever-growing village landscape by placing tiles. Explore a variety of colorful biomes, discover and unlock new tiles and complete quests to fill your world with life!",78.36637064977938,"['Puzzle', 'Simulator', 'Strategy', 'Turn-based strategy (TBS)', 'Indie', 'Card & Board Game']","['PC (Microsoft Windows)', 'Nintendo Switch']",['Toukana Interactive'],//images.igdb.com/igdb/image/upload/t_cover_big/co2lzk.jpg,https://www.youtube.com/watch?v=u9KpcOurPd8
355,Dot Big Bang,1.0,0.0,1.67,1.43,0.0,1.0,2.5,0.0,0.98,A platform that lets everyone create and share games anywhere.,,,,['ControlZee'],//images.igdb.com/igdb/image/upload/t_cover_big/co2py9.jpg,https://www.youtube.com/watch?v=1Po_S9qum5w
356,Dot's Home,1.25,0.0,2.22,4.29,1.43,3.0,2.5,0.0,1.97,"Dot's Home is a single player game about Dorothea (Dot) Hawkins, a young Black woman in her late 20’s living with her grandmother Mavis Hawkins in Detroit, Michigan. Following a cryptic conversation with her grandmother, Dot receives a mysterious key. This key allows Dot to open a door within her house and travel to another space in time within her own family history.

In order to return home, Dot finds that she must interact with and influence her family members to make important life decisions in order to receive a key back to her present, but Dot soon finds out that her journey to the past is steadily affecting her current reality…as well as the potential future.",,"['Point-and-click', 'Adventure', 'Indie']","['PC (Microsoft Windows)', 'Mac']","['Rise-Home Stories Project', 'Weathered Sweater', 'Aerial_Knight', 'Titan ARX Interactive']",//images.igdb.com/igdb/image/upload/t_cover_big/co437w.jpg,
357,DotA 2,1.0,0.0,0.56,2.14,0.71,1.5,7.5,3.75,1.48,,,,,,,
358,Double Kick Heroes,1.75,7.5,1.67,2.86,0.71,1.5,2.5,0.0,1.8,Double Kick Heroes mixes a shoot'em up with a rhythm game. You must survive on the highway to hell by killing monsters with your gundillac. Only the power of METAL can save your band!,67.16021622344202,"['Fighting', 'Shooter', 'Music', 'Indie', 'Arcade']","['PC (Microsoft Windows)', 'Mac', 'Xbox One', 'Nintendo Switch']","['WhisperGames', 'Headbang Club', 'Plug In Digital']",//images.igdb.com/igdb/image/upload/t_cover_big/co2eo5.jpg,https://www.youtube.com/watch?v=G2bbITg05w4
359,Downpour,1.0,0.0,0.56,0.71,0.0,0.0,2.5,0.0,0.57,"Downpour is a hardcore 2D Base survival game. A simple game in concept, but a complexity in practice. Protect an Antenna that is being built from endless enemies so you can contact home. All the while managing closely tied resources. Death will probably come many times.",,"['Simulator', 'Indie']",['PC (Microsoft Windows)'],,,
360,Downwell,0.75,0.0,0.0,2.14,0.0,1.0,2.5,0.0,0.74,Downwell is a curious game about a young man with guns for boots venturing down a well in search of untold treasures. Make your way further and further down into a darkness filled with nasty creatures and mysterious secrets and collect the spectacular red gems scattered about the rocks. Step into an oddly placed shop to buy some helpful items or level up between caverns to battle well dwelling monsters and uncover hidden caves filled with riches and relics. No two trips down the well are ever the same!,76.3912390112263,"['Shooter', 'Platform', 'Adventure', 'Indie', 'Arcade']","['PC (Microsoft Windows)', 'Android', 'iOS', 'PlayStation Vita', 'PlayStation 4', 'Nintendo Switch']","['Devolver Digital', 'Moppin', 'Red Phantom Games']",//images.igdb.com/igdb/image/upload/t_cover_big/co284e.jpg,https://www.youtube.com/watch?v=kY83H8BdxhI
361,Dr Umgebung's School of Life,0.0,0.0,0.56,0.0,0.0,0.0,0.0,0.0,0.08,,,,,,,
362,Dragon Age II,1.5,5.0,1.67,2.14,2.86,2.5,5.0,0.0,2.05,"Dragon Age II is the sequel to Dragon Age: Origins and the second major game in the series. Like its predecessor, players can explore and engage in combat from a third-person perspective and will also encounter various companions who play major roles in the plot and gameplay. Depending on players' decisions and dialogue, a companion will either recognize the main character Hawke as a friend or a rival. The game adopts the wheel-based dialogue system, meaning short responses that reflect different tones and attitudes the player wishes to choose for Hawke. The combat system is quite similar to the one used in the previous Dragon Age game, though it has been noticeably sped up.",74.32575387066528,"['Role-playing (RPG)', 'Adventure']","['PC (Microsoft Windows)', 'PlayStation 3', 'Xbox 360', 'Mac']","['Electronic Arts', 'BioWare Edmonton', 'BioWare Austin', 'BioWare Mythic', 'Mesopotamia Software', 'TransGaming Technologies']",//images.igdb.com/igdb/image/upload/t_cover_big/co2mw1.jpg,https://www.youtube.com/watch?v=Rh43mO4Huds
363,Dragon Age: Inquisition,1.25,5.0,1.67,2.14,2.14,2.0,5.0,1.25,1.89,"Dragon Age: Inquisition is a role-playing game and the third main game in the Dragon Age series. It is set in the Thedas continent, the same fantasy world as the two previous games. It consist of two large countries: Ferelden (from Dragon Age: Origins) and Orlais, as well as the land inbetween.

True to the spirit of the series the character can be customized for appearance, sex, class and race. The available races are dwarf, elf, human, and Qunari and the classes are mage, rogue, and warrior with three specializations each. To grow the Inquisition experience needs to be earned by completing quests, which allows the player to further define allegiances and pursue romances.

A custom party can be defined and each member benefits from experience as it opens up access to better weapons and more abilities. Power points open up new areas and Inquisition points define the influence over the region; each new level provides a perk that benefits the entire Inquisition.",83.04279254211278,"['Role-playing (RPG)', 'Tactical', 'Adventure']","['PC (Microsoft Windows)', 'PlayStation 3', 'Xbox 360', 'PlayStation 4', 'Xbox One']","['Electronic Arts', 'BioWare', 'BioWare Edmonton']",//images.igdb.com/igdb/image/upload/t_cover_big/co2mvy.jpg,https://www.youtube.com/watch?v=WBB5XEyK1vg
364,Dragon Age: Origins,1.25,5.0,2.22,2.14,2.86,2.0,5.0,0.0,1.97,"Dragon Age: Origins is a third-person role-playing game described as a spiritual successor to Baldur's Gate and Neverwinter Nights franchises. Players create their own character by customizing gender and appearance as well as choosing a race and class. Combat is in real time with the ability to pause at any moment: tactical options include an editor which allows the player to give the AI detailed instructions on how to behave in every possible situation. Although the main storyline is the same for every character created, the game features six unique prologues, two for each race. Dragon Age: Origins received critical acclaim upon release, with praise mostly directed at its story, setting, characters, music and combat system.",86.23143753649542,['Role-playing (RPG)'],"['PC (Microsoft Windows)', 'PlayStation 3', 'Xbox 360', 'Mac']","['Electronic Arts', 'Edge of Reality', 'BioWare Edmonton']",//images.igdb.com/igdb/image/upload/t_cover_big/co2mvs.jpg,https://www.youtube.com/watch?v=cfSAlyiI1mc
365,Draw a Stickman: Epic 3,0.25,0.0,2.22,2.86,0.71,0.0,0.0,0.0,0.82,"Your creativity will be maximized in the all-new Draw a Stickman: EPIC 3! Embark upon an exhilarating new adventure to defeat the Corruption: solve fun puzzles, outsmart crafty monsters, and discover an all-new world! So grab your freshly penciled Hero—it’s time to be EPIC!",,"['Puzzle', 'Adventure', 'Indie']","['PC (Microsoft Windows)', 'Xbox One', 'Nintendo Switch']","['Pocket Pinata', 'Hitcents']",//images.igdb.com/igdb/image/upload/t_cover_big/co2cfc.jpg,https://www.youtube.com/watch?v=VSa-59PZQAY
366,Draw!,1.25,0.0,1.11,2.14,0.0,2.0,7.5,0.0,1.39,,,,,,,
367,Dread Hunger,0.5,0.0,0.56,2.14,0.71,2.0,2.5,2.5,1.15,"A game of horror, survival, and betrayal. Explorers path their ship through the unforgiving Arctic. Among the crew, two traitors call on dark powers to undermine them.",,"['Shooter', 'Adventure', 'Indie']",['PC (Microsoft Windows)'],"['Digital Confectioners', 'Dread Hunger Team', 'Slowdrive Studios']",//images.igdb.com/igdb/image/upload/t_cover_big/co2ygq.jpg,https://www.youtube.com/watch?v=LJCI1j-N58M
368,Dreams,2.5,0.0,2.78,3.57,1.43,2.0,7.5,0.0,2.38,A soothing spot the difference game. Each play will result in a difference experience with new differences being shown.,,['Puzzle'],['Web browser'],"['DifferenceGames', 'Gimme5Games']",//images.igdb.com/igdb/image/upload/t_cover_big/co7rb7.jpg,
369,Dreams Party!,1.0,0.0,1.11,2.14,0.71,0.0,5.0,0.0,0.98,,,,,,,
370,Dreamscape,1.25,0.0,0.56,3.57,0.71,2.0,2.5,0.0,1.39,"Just a normal day. Erin was quite happy how things were, studying biology and off to see her boyfriend. He, however, was about to change everything.

Her boyfriend, Terry, wants her to just watch him as he listens to a tune. He says it will be a special experience. She says he should stop joking but since he insists she gives him what he wants. After all, it's only wasting a few seconds of time.

Terry puts his headphones on. The next moment - the bedroom no longer exists. Erin has entered another world. She can only call out as she sees Terry across a bridge from where she is standing just moving away from her. Further and further away. Then, she is alone with nothing around her.

What has happened? Will Erin pierce the secret of Dreamscape? And will she ever find Terry again?",70.0,"['Role-playing (RPG)', 'Strategy', 'Adventure', 'Indie']",['PC (Microsoft Windows)'],['Degica Games'],//images.igdb.com/igdb/image/upload/t_cover_big/uuvpqvlaigk4lqy5kyyk.jpg,
371,Dredge,2.0,5.0,3.33,2.14,0.71,2.0,5.0,0.0,2.13,"Dredge is a fishing adventure with a sinister undercurrent. Sell your catch, upgrade your vessel and dredge the depths for long-buried relics. Explore the stories of the strange locals and discover why some things are best left forgotten.",80.8430149374548,"['Role-playing (RPG)', 'Simulator', 'Adventure']","['PC (Microsoft Windows)', 'PlayStation 4', 'Xbox One', 'Nintendo Switch', 'PlayStation 5', 'Xbox Series X|S']","['Black Salt Games', 'Team17']",//images.igdb.com/igdb/image/upload/t_cover_big/co69zw.jpg,https://www.youtube.com/watch?v=2bnJ46Am9Dk
372,Drink More Glurp,0.75,0.0,0.0,2.14,0.0,0.5,2.5,0.0,0.66,"Drink More Glurp is a wacky physics, sports(ish), hot seat, party game. Aliens have copied our 'Earth' games and have got it all slightly wrong. Sponsors will randomly take control of events and twist them to fit their agenda creating havoc for the athletes. Support for up to 20 players all from one controller.",,"['Sport', 'Indie']","['Linux', 'PC (Microsoft Windows)', 'Mac', 'Nintendo Switch']","['CATASTROPHIC_OVERLOAD', 'The Yogscast']",//images.igdb.com/igdb/image/upload/t_cover_big/co2iaw.jpg,
373,Drone The Game,2.25,2.5,2.22,1.43,0.0,1.5,2.5,2.5,1.8,,,,,,,
374,Dropsy,1.25,0.0,2.78,2.86,2.14,2.0,5.0,0.0,1.89,"After a deadly circus fire shatters his world and tarnishes his name, Dropsy the Clown finds himself on a journey of self-discovery through a story that harnesses powerful themes of love and kindness. With his father gravely ill and the world turning its back on a once happy-go-lucky clown, Dropsy will need to help those in need, hug total strangers, and unravel dark and shameful secrets from his past on the way to redemption. Oh, and Dropsy can also talk to animals.

Dropsy is a non-traditional take on the classic point and click adventure formula starring the game’s perpetually carefree namesake clown as he explores a richly detailed world full of colorful characters and sinister secrets, doling out hugs along the way. Rather than lead players on a singular narrative path, players are free to choose which avenues of adventure they want to explore in an open world setting and can piece the puzzles and story together however they choose.",78.36123013641982,"['Point-and-click', 'Puzzle', 'Adventure', 'Indie']","['Linux', 'PC (Microsoft Windows)', 'Mac', 'Android', 'iOS', 'Nintendo Switch']","['A Jolly Corpse', 'Tendershoot', 'Devolver Digital']",//images.igdb.com/igdb/image/upload/t_cover_big/co2fl0.jpg,https://www.youtube.com/watch?v=It72E3EbJNk
375,Due Process,1.25,0.0,1.11,1.43,0.0,2.0,7.5,2.5,1.48,A PVP tactical FPS about planning & execution. Sound strategy and good teamwork are essential for victory because new procedurally-generated maps are delivered every week. You'll face a new tactical challenge every round.,,"['Shooter', 'Indie']",['PC (Microsoft Windows)'],['Giant Enemy Crab'],//images.igdb.com/igdb/image/upload/t_cover_big/co2hke.jpg,
376,Dungeon and Puzzles,1.5,0.0,2.78,2.86,2.14,2.5,5.0,0.0,2.05,"Dungeon and Puzzles is a 2D spatial logic and ability switch puzzle game. The adventurer's ability depends on what equipment he currently uses. You have to think through every step. After clearing the level, you can try other routes of strategy to optimize your solution.",,"['Puzzle', 'Role-playing (RPG)', 'Strategy', 'Adventure', 'Indie', 'Card & Board Game']","['PC (Microsoft Windows)', 'iOS', 'Nintendo Switch']","['HuMoFish', 'Digital Crafter']",//images.igdb.com/igdb/image/upload/t_cover_big/co2nvd.jpg,https://www.youtube.com/watch?v=W4crpcboF60
377,Dungeons of Dreadrock,1.5,0.0,0.56,2.14,0.0,0.0,0.0,0.0,0.82,"The Spirit of 1980's home computer RPGs revived for contemporary audiences and platforms.
Dig your way through 100 handcrafted levels into the ancient depths of Dreadrock Mountain.
Relive memories of oldschool dungeon crawlers, like Dungeon Master and Eye of the Beholder.
Play short sessions on your mobile phone or tablet, and fight and puzzle over hours of playtime.",,"['Puzzle', 'Role-playing (RPG)', 'Adventure', 'Indie']","['PC (Microsoft Windows)', 'Android', 'iOS', 'Nintendo Switch']",['Prof. Dr. Christoph Minnameier'],//images.igdb.com/igdb/image/upload/t_cover_big/co5ho4.jpg,https://www.youtube.com/watch?v=9HmFykKLdqQ
378,Dysmantle,2.0,0.0,2.78,2.86,2.86,2.0,5.0,0.0,2.21,"The open world action RPG where you can ruin everything.

Ascend from your shelter. Escape the wretched island.

Explore. Fight. Level up. Survive. Gather. Craft. Harvest. Hunt. Build. Farm. Solve puzzles. Fish. Cook. Live. Enjoy the bittersweet post-apocalypse.",60.46043459840994,"['Puzzle', 'Role-playing (RPG)', 'Simulator', 'Adventure', 'Indie']","['Linux', 'PC (Microsoft Windows)', 'Mac', 'iOS', 'PlayStation 4', 'Xbox One', 'Nintendo Switch', 'PlayStation 5', 'Xbox Series X|S']",['10tons Ltd.'],//images.igdb.com/igdb/image/upload/t_cover_big/co1ixi.jpg,https://www.youtube.com/watch?v=1zbSFUROKYo
379,Depanneur Nocturne,0.0,0.0,2.22,3.57,0.0,0.5,0.0,0.0,0.82,,,,,,,
380,EA Sports FC 24,1.5,7.5,2.78,1.43,3.57,2.0,5.0,2.5,2.38,"EA SPORTS FC 24 is the ultimate football simulation game that lets you play as your favourite stars and teams in the most authentic and immersive way possible. With EA SPORTS FC, you can experience the thrill of the world's biggest competitions, such as the Premier League, UEFA Champions League, UEFA Women's Champions League, La Liga Santander, Bundesliga, Ligue 1, Serie A, CONMEBOL Libertadores, Barclays Women's Super League, NWSL and many more. EA SPORTS FC 24 also features a new brand identity inspired by the triangles that have been part of EA SPORTS football for the past 30 years, from the isometric polygons that make up the game to the chemistry triangles that exist in Ultimate Team to the player indicator across every match. Join the Club and be part of a new Football Club for the future of football we want to build together.",49.22610932082215,"['Simulator', 'Sport']","['PC (Microsoft Windows)', 'PlayStation 4', 'Xbox One', 'Nintendo Switch', 'PlayStation 5', 'Xbox Series X|S']","['EA Romania', 'EA Vancouver', 'EA Sports']",//images.igdb.com/igdb/image/upload/t_cover_big/co6qqa.jpg,https://www.youtube.com/watch?v=XhP3Xh4LMA8
381,Eagle Island,1.0,5.0,2.22,2.14,0.0,2.5,0.0,0.0,1.48,,,"['Adventure', 'Indie']","['Linux', 'PC (Microsoft Windows)', 'Mac']",,//images.igdb.com/igdb/image/upload/t_cover_big/co7ga4.jpg,
382,Ear Hockey,1.0,2.5,1.11,2.14,0.71,4.0,2.5,0.0,1.64,,,,,,,
