,Game,Controls,Difficulty,Getting Started,Reading,Navigation,Visual,Audio,Communication,Total,Summary,Rating,Genres,Platforms,Companies,Cover,Video
747,Little Bug,1.0,0.0,1.67,2.14,0.0,2.0,5.0,0.0,1.31,"Little Bug is an adventure platformer where you coordinate two playable characters who share a physics based swinging mechanic in real time. Nyah can walk and pick up items, while her spirit light can fly and explore dark areas.",70.0,"['Platform', 'Puzzle', 'Adventure', 'Indie']","['Linux', 'PC (Microsoft Windows)', 'Mac', 'Xbox One', 'Nintendo Switch']","['Buddy System', 'Fig Publishing Inc.']",//images.igdb.com/igdb/image/upload/t_cover_big/co2j2p.jpg,https://www.youtube.com/watch?v=BVGELO_9-g0
748,Little Hellions,1.0,0.0,1.67,1.43,0.0,2.5,5.0,0.0,1.31,4 friends. 1 weirdo mechanic. Throw away your friends with your trusty Trick Hook in this passive aggressive fighter where you can’t fight!,,"['Fighting', 'Arcade']",['PC (Microsoft Windows)'],"['Schadenfreude', 'Violet Games']",//images.igdb.com/igdb/image/upload/t_cover_big/co5a78.jpg,https://www.youtube.com/watch?v=ue9xySpXMqU
749,Little King's Story,0.25,0.0,0.0,0.0,0.0,0.0,0.0,0.0,0.08,"""Initially released for Wii to rave reviews, this cult classic real-time strategy game juxtaposes cutesy fairytale visuals with some decidedly adult cynicism for a zany, irreverent adventure to build, enhance, and maintain a mystical, magical kingdom. Making its way to PC for the first time, this edition of the game remains faithful to the Wii original, but brings all its charming, sassy fun to a new audience. Can you keep Alpoko safe from the Onii and help our little hero become king of the whole world?""",70.72655195316776,"['Real Time Strategy (RTS)', 'Role-playing (RPG)', 'Simulator', 'Strategy']","['Wii', 'PC (Microsoft Windows)']","['Cing', 'Rising Star Games', 'XSEED Games', 'Marvelous Entertainment']",//images.igdb.com/igdb/image/upload/t_cover_big/co1uve.jpg,https://www.youtube.com/watch?v=cBffUzqE6Hw
750,Little Misfortune,0.75,0.0,1.67,2.86,0.71,1.0,5.0,0.0,1.23,"Little Misfortune is an interactive story, focused on exploration and characters, both sweet and dark, where your choices have consequences.",73.82602781425355,"['Point-and-click', 'Platform', 'Puzzle', 'Adventure', 'Indie', 'Arcade']","['Linux', 'PC (Microsoft Windows)', 'Mac', 'PlayStation 4', 'Xbox One', 'Nintendo Switch']",['Killmonday Games HB'],//images.igdb.com/igdb/image/upload/t_cover_big/co1kw9.jpg,https://www.youtube.com/watch?v=ScO3SsbcFSU
751,Little Nightmares II,1.0,0.0,0.0,0.71,0.0,0.0,0.0,0.0,0.41,"Little Nightmares II is a suspense-adventure game in which you play as Mono, a young boy trapped in a world that has been distorted by the humming transmission of a distant tower. With Six, the girl in a yellow raincoat, as his guide, Mono sets out to discover the dark secrets of The Signal Tower and save Six from her terrible fate; but their journey will not be straightforward as Mono and Six will face a gallery of new threats from the terrible residents of this world.

Will you dare to face this collection of new, little nightmares?",82.45714941300749,"['Platform', 'Puzzle', 'Adventure']","['PC (Microsoft Windows)', 'PlayStation 4', 'Xbox One', 'Nintendo Switch', 'PlayStation 5', 'Xbox Series X|S', 'Google Stadia']","['Bandai Namco Entertainment', 'Tarsier Studios', 'Supermassive Games']",//images.igdb.com/igdb/image/upload/t_cover_big/co1p7d.jpg,https://www.youtube.com/watch?v=AI9zBBTyX-E
752,LittleBigPlanet 3,0.5,0.0,0.0,0.0,0.0,0.0,0.0,0.0,0.16,"In LittleBigPlanet 3, explore a world filled with creativity as you explore all corners of the Imagisphere, meet the inhabitants of the mysterious planet Bunkum and face the nefarious Newton. Discover endless surprises that the LittleBigPlanet Community have created and shared for you to enjoy, with new levels and games to play every day. Then if you're feeling inspired, flex your creative muscles with the powerful and intuitive customization tools, to bring your own imagination to life in LittleBigPlanet 3.",73.25069104341311,"['Platform', 'Adventure']","['PlayStation 3', 'PlayStation 4']","['Sumo Digital', 'D3T Limited', 'Sony Computer Entertainment']",//images.igdb.com/igdb/image/upload/t_cover_big/co3t1c.jpg,https://www.youtube.com/watch?v=rmYiNxZQRZY
753,Littlewood,0.0,0.0,1.11,0.0,0.0,0.0,0.0,0.0,0.16,"The world has already been saved. Now it's time to rebuild your town, learn new hobbies, and forge lifelong friendships in this peaceful and relaxing RPG.",63.96221007685583,"['Role-playing (RPG)', 'Simulator', 'Adventure', 'Indie']","['Linux', 'PC (Microsoft Windows)', 'Mac', 'Nintendo Switch']","['Sean Young', 'SmashGames']",//images.igdb.com/igdb/image/upload/t_cover_big/co1l12.jpg,https://www.youtube.com/watch?v=Xv7gnhAP3as
754,Llama Villa,1.25,0.0,2.78,2.14,0.71,2.0,0.0,0.0,1.48,"""The Sims but with llamas"". Shower, feed, and shear your llamas! Play with your llamas, buy them nice furniture, and acquire even more llamas. Build a llama villa!",,"['Simulator', 'Indie']","['PC (Microsoft Windows)', 'Mac']",['Sokpop Collective'],//images.igdb.com/igdb/image/upload/t_cover_big/co26zx.jpg,https://www.youtube.com/watch?v=NDTrtPkMhTU
755,LocoRoco,0.0,0.0,0.0,0.0,0.0,0.5,0.0,0.0,0.08,"The peaceful world of the LocoRoco are under attack by the not-so-nice Moja Corps! These evil outer space creatures have come to take the LocoRoco from their land of blowing flowers, lively creatures and pastel scenery. As the planet where the LocoRoco inhabit, you must move them through more than 40 levels of slippery slopes, teetering platforms and maze-like passages. The LocoRoco have the uncanny ability to fluidly morph to their landscape, so all you need is to tilt, roll and bounce the happy blob-like creatures to safety!",81.72559688325343,"['Platform', 'Puzzle', 'Strategy', 'Adventure']","['PlayStation Portable', 'Legacy Mobile Device']","['SCE Japan Studio', 'Sony Computer Entertainment']",//images.igdb.com/igdb/image/upload/t_cover_big/co1pnk.jpg,https://www.youtube.com/watch?v=50t1CFY08ps
756,Lonely Mountains Downhill,1.0,0.0,2.22,0.71,0.71,2.5,5.0,0.0,1.39,,,,,,,
757,Lonesome Village,0.5,0.0,3.33,3.57,2.14,2.0,2.5,0.0,1.72,"Lonesome Village is a cozy, quiet town struggling to rebuild after a strange calamity wiped out their homes.

Take the role of Wes the coyote and help bring this village back from the brink of destruction in a puzzle-filled life sim!",,"['Puzzle', 'Simulator', 'Adventure', 'Indie']","['Linux', 'PC (Microsoft Windows)', 'Mac', 'Android', 'iOS', 'Xbox One', 'Nintendo Switch', 'Xbox Series X|S']",['Ogre Pixel'],//images.igdb.com/igdb/image/upload/t_cover_big/co45ed.jpg,https://www.youtube.com/watch?v=xmEbWFCNJaY
758,Loop Hero,1.0,0.0,2.22,3.57,0.0,0.5,7.5,0.0,1.39,"The Lich has thrown the world into a timeless loop and plunged its inhabitants into never ending chaos. Wield an expanding deck of mystical cards to place enemies, buildings, and terrain along each unique expedition loop for the brave hero.",75.22964085137542,"['Role-playing (RPG)', 'Strategy', 'Adventure', 'Indie', 'Card & Board Game']","['Linux', 'PC (Microsoft Windows)', 'Mac', 'Android', 'iOS', 'Xbox One', 'Nintendo Switch', 'Xbox Series X|S']","['Devolver Digital', 'Four Quarters', 'Playdigious']",//images.igdb.com/igdb/image/upload/t_cover_big/co2mfy.jpg,https://www.youtube.com/watch?v=G37bO9vg8RY
759,Loot River,2.75,5.0,1.67,2.14,2.86,3.5,7.5,0.0,2.7,"Set in a series of procedurally generated labyrinths, Loot River is a dungeon crawling action roguelike that combines tense, real-time combat and dark fantasy settings with spatial block-shifting.",74.7550377770161,"['Role-playing (RPG)', 'Strategy', ""Hack and slash/Beat 'em up"", 'Adventure', 'Indie']","['PC (Microsoft Windows)', 'PlayStation 4', 'Xbox One', 'PlayStation 5', 'Xbox Series X|S']","['straka.studio', 'SUPERHOT PRESENTS']",//images.igdb.com/igdb/image/upload/t_cover_big/co2wa9.jpg,https://www.youtube.com/watch?v=WMXi4QG19aA
760,Lost Ark,1.75,0.0,2.22,2.14,4.29,1.0,2.5,1.25,1.97,"Embark on an odyssey for the Lost Ark in a vast, vibrant world: explore new lands, seek out lost treasures, and test yourself in thrilling action combat. Define your fighting style with your class and advanced class, and customize your skills, weapons, and gear to bring your might to bear as you fight against hordes of enemies, colossal bosses, and dark forces seeking the power of the Ark in this action-packed free-to-play RPG.",72.96627562248791,"['Role-playing (RPG)', ""Hack and slash/Beat 'em up"", 'Adventure']",['PC (Microsoft Windows)'],"['Smilegate RPG', 'Tripod Studio', 'Amazon Game Studios', 'GameOn', 'My.com']",//images.igdb.com/igdb/image/upload/t_cover_big/co4w4j.jpg,https://www.youtube.com/watch?v=4Sjlex_DdGk
761,Lost Ember,1.5,2.5,2.22,2.14,0.71,0.5,5.0,0.0,1.48,"Explore the remains of a fallen world from fascinating perspectives! Slip into the role of different animals to uncover the fate of an ancient world. Dive into deep waters, fly at lofty heights, dig underground as a mole or even climb steep cliffs with a mountain goat, there are lots of ways of getting around.",79.09573201399263,"['Adventure', 'Indie']","['PC (Microsoft Windows)', 'PlayStation 4', 'Xbox One', 'Nintendo Switch']","['Mooneye Studios', 'Pingle Game Studio']",//images.igdb.com/igdb/image/upload/t_cover_big/co2g2a.jpg,https://www.youtube.com/watch?v=vo7CPfVu7MY
762,Lost In Play,1.5,0.0,3.33,3.57,0.0,2.0,5.0,0.0,1.89,,,,,,,
763,Lost Nova,0.75,0.0,2.78,2.86,0.71,2.5,5.0,0.0,1.64,"Your spaceship crashed on an alien planet. Explore, salvage, craft, trade, manage and upgrade your way back home!",,"['Platform', 'Simulator', 'Adventure', 'Indie']",['PC (Microsoft Windows)'],"['Jon Nielsen', 'HopFrog']",//images.igdb.com/igdb/image/upload/t_cover_big/co45fz.jpg,https://www.youtube.com/watch?v=9PXba1GfDIE
764,Lost Words: Beyond the Page,1.5,0.0,3.33,2.86,1.43,3.0,7.5,0.0,2.21,"Lost Words is a 2D narrative adventure game where players move words to solve puzzles. The game features a story written by Rhianna Pratchett and ties the narrative into the gameplay in an unusual way, by having the player running on and interacting with words to solve puzzles.",60.75590698740591,"['Platform', 'Puzzle', 'Adventure', 'Indie']","['PC (Microsoft Windows)', 'Android', 'iOS', 'PlayStation 4', 'Xbox One', 'Nintendo Switch', 'Xbox Series X|S', 'Google Stadia']","['Maximum Games', 'Sketchbook Games', 'Modus Games']",//images.igdb.com/igdb/image/upload/t_cover_big/co2x90.jpg,https://www.youtube.com/watch?v=zRXOZs41v50
765,Lost and Hound,1.25,0.0,4.44,2.86,4.29,5.0,10.0,0.0,3.03,"Lost and Hound is a scent hound adventure following the reluctant yet strong-willed Corgi, Biscuit. Hunt down criminals, help people that are in trouble or lost, solve mysteries and save lives in this blind-accessible canine story.",,"['Simulator', 'Adventure', 'Indie']",['PC (Microsoft Windows)'],['Daisy Ale Soundworks'],//images.igdb.com/igdb/image/upload/t_cover_big/co2iln.jpg,https://www.youtube.com/watch?v=yEuawJ9rCrk
766,Lost in Random,1.0,5.0,2.78,3.57,4.29,2.0,5.0,0.0,2.3,"Welcome to the world of Random, a dark kingdom where every citizen’s future is determined by the roll of a dice. Will you be defeated by your fate or embrace chaos and learn to make it work in your favor? Embark on a journey with Even and her sidekick Dicey to play the odds and break the curse of Random.",70.0481746860327,"['Role-playing (RPG)', 'Adventure']","['PC (Microsoft Windows)', 'PlayStation 4', 'Xbox One', 'Nintendo Switch', 'PlayStation 5', 'Xbox Series X|S']","['Zoink Games', 'Electronic Arts']",//images.igdb.com/igdb/image/upload/t_cover_big/co3xva.jpg,https://www.youtube.com/watch?v=diilMn5gSAg
767,Love - A Puzzle Box Filled with Stories,0.25,0.0,2.22,0.71,0.71,1.0,0.0,0.0,0.74,,,,,,,
768,Love You To Bits,0.75,0.0,1.67,1.43,0.71,4.0,2.5,0.0,1.48,,,,,,,
769,Lovebirb,0.75,5.0,2.22,2.86,1.43,3.0,5.0,1.25,1.97,"Play as a heartbroken bird, ready to dip back in the dating scene, and impress your dates by flirting to the rhythm of the music.",,"['Role-playing (RPG)', 'Simulator', 'Indie']",['PC (Microsoft Windows)'],['Anonymous Penguin Studios'],//images.igdb.com/igdb/image/upload/t_cover_big/co4v02.jpg,https://www.youtube.com/watch?v=O5n9QgkyaHM
770,Luck Be A Landlord,2.75,0.0,2.22,3.57,1.43,1.5,0.0,0.0,2.05,,,,,,,
771,Luckitown,1.25,0.0,2.78,2.14,2.14,1.0,2.5,0.0,1.56,Luckitown is a turn-based tower defense where you roll dice to build new structures and cast spells to defend your town.,,"['Simulator', 'Strategy', 'Turn-based strategy (TBS)', 'Tactical', 'Indie']","['PC (Microsoft Windows)', 'Mac']",['Sokpop Collective'],//images.igdb.com/igdb/image/upload/t_cover_big/co5jmy.jpg,https://www.youtube.com/watch?v=IHdM4913zbE
772,Lucky Hero,1.25,0.0,2.78,2.14,1.43,3.0,5.0,0.0,1.89,"""Lucky Hero"" is a Roguelike symbol-building game. Your weapons and equipment have transformed into symbols, and by spinning the Wheel of Fortune, you will face various powerful enemies. This game offers a vast array of symbols and character skills for players to explore and combine.",,"['Strategy', 'Indie', 'Card & Board Game']",['PC (Microsoft Windows)'],"['mora churrasco studio', 'Neverland Entertainment']",//images.igdb.com/igdb/image/upload/t_cover_big/co7dmt.jpg,https://www.youtube.com/watch?v=dDWrExe6keo
773,Lucky Luna,1.0,0.0,1.67,2.86,0.71,2.0,5.0,0.0,1.48,"Lucky Luna is a vertical scrolling platformer in which players will explore temples and dungeons while learning about the past of the protagonist Luna. Interestingly, there’s no jump button in the game.",,"['Platform', 'Adventure', 'Arcade']","['Android', 'iOS']","['Snowman', 'Netflix']",//images.igdb.com/igdb/image/upload/t_cover_big/co5fbc.jpg,https://www.youtube.com/watch?v=2Jhfofq-ehw
774,Lueur and the Dim Settlers,1.25,2.5,6.11,2.86,2.86,3.0,2.5,0.0,2.62,,,,,,,
775,Luigi's Mansion,0.75,0.0,1.67,4.29,2.14,2.5,2.5,0.0,1.72,"G-g-ghosts!
All this ghost-catching tomfoolery pays off! As you suck 'em up with your Poltergust 3000, you could also rake in millions in hidden, in-game riches for our hard-luck hero. Make sure to search every area using the Game Boy Horror's map on your touchscreen and activate its Boo Radar to track down every Boo in the mansion or spot ghosts' weak points. After beating and capturing boss ghosts, you can select their portraits from the gallery to best your own score in tense rematches—a new feature in the Nintendo 3DS version!",85.78513835779478,['Adventure'],['Nintendo 3DS'],"['Nintendo of America', 'Nintendo', 'Grezzo']",//images.igdb.com/igdb/image/upload/t_cover_big/co1wmb.jpg,https://www.youtube.com/watch?v=ISfP0L9rEys
776,Luigi's Mansion 2,0.5,0.0,1.67,2.86,2.86,2.0,2.5,0.0,1.48,,,,,,,
777,Luigi's Mansion 3,0.75,0.0,1.67,3.57,2.86,2.5,2.5,1.25,1.8,"Luigi embarks on a dream vacation with Mario and friends upon receiving an invitation to a luxurious hotel. However, his dream quickly becomes a nightmare when King Boo reveals everything had been a ploy to capture Mario and friends. With the assistance of Professor E. Gadd once again, the reluctant and cowardly hero Luigi traverses up and down treacherous floors of the now-ominous hotel on a quest to save them.",83.38392075624532,['Adventure'],['Nintendo Switch'],"['Nintendo', 'Next Level Games']",//images.igdb.com/igdb/image/upload/t_cover_big/co22a9.jpg,https://www.youtube.com/watch?v=GHhY-SUYOms
778,Lumen,1.25,0.0,3.33,2.86,0.0,2.0,2.5,0.0,1.64,,,,,,,
779,Lumi Nova: Tales of Courage,0.25,2.5,0.56,2.14,0.71,1.0,0.0,0.0,0.74,,,,,,,
780,Luna The Shadow Dust,0.5,0.0,3.33,0.71,2.14,3.0,2.5,0.0,1.56,,,,,,,
781,Lushfoil Photography Sim,2.0,0.0,5.56,2.86,1.43,1.5,0.0,1.25,2.3,An exploration/photography experience set across a vast selection of faithfully detailed landscapes.,,"['Simulator', 'Adventure', 'Indie']",['PC (Microsoft Windows)'],"['Annapurna Interactive', 'Matt Newell']",//images.igdb.com/igdb/image/upload/t_cover_big/co5jno.jpg,https://www.youtube.com/watch?v=PBFG0Hg3uCo
782,Mafia Definitive Edition,0.0,0.0,0.0,0.0,0.71,0.0,0.0,0.0,0.08,,,,,,,
783,Magnibox,0.75,2.5,1.11,0.71,0.71,3.5,2.5,0.0,1.31,Magnibox is a colorful and challenging puzzle game about a magnet that's also a box. Hand-crafted for your brain to enjoy!,70.0,"['Puzzle', 'Indie']","['PC (Microsoft Windows)', 'Mac']",['Joseph Gribbin'],//images.igdb.com/igdb/image/upload/t_cover_big/co1kiz.jpg,https://www.youtube.com/watch?v=tEzRcGb8X5I
784,Mail Time,1.75,0.0,3.89,3.57,2.14,2.5,5.0,0.0,2.38,"Cottagecore cozy adventure game about delivering mail to forest animals! take on the role of a fresh-on-the-job Mail Scout given her very first letter to deliver. All you have to do is find out exactly where the recipient Greg lives and deliver the letter, no biggie!",,"['Platform', 'Adventure', 'Indie']","['PC (Microsoft Windows)', 'Mac', 'PlayStation 4', 'Nintendo Switch', 'PlayStation 5']","['Freedom Games', 'Kela van der Deijl']",//images.igdb.com/igdb/image/upload/t_cover_big/co790l.jpg,https://www.youtube.com/watch?v=pTQ7Gq6S4oM
785,Majotori,2.25,0.0,2.22,3.57,1.43,3.5,2.5,0.0,2.3,"Majotori is a collection of tales with which you interact by playing trivia. A witch appears to different characters after they make a wish and offers to make it come true if they play a game of trivia with her. Majotori's Carefully Crafted Selection of Questions includes all kind of subjects but focuses on video games, cinema and animation.",74.51755619654806,"['Quiz/Trivia', 'Adventure', 'Indie']","['Linux', 'PC (Microsoft Windows)', 'Mac', 'Android', 'iOS']",['Majorariatto'],//images.igdb.com/igdb/image/upload/t_cover_big/co24z0.jpg,https://www.youtube.com/watch?v=JHlM6kWii1A
786,Mana Spark,0.75,0.0,1.11,2.14,1.43,1.5,7.5,0.0,1.31,A challenging action RPG with deep souls-like combat and rogue-like elements. Explore a dreadful dungeon and fight smart enemies that will plan and collaborate between themselves to defeat you.,60.16987955977945,"['Role-playing (RPG)', 'Adventure', 'Indie']","['Linux', 'PC (Microsoft Windows)', 'Mac', 'PlayStation 4', 'Nintendo Switch']","['BEHEMUTT', 'Kishimoto Studios', 'Qubic Games']",//images.igdb.com/igdb/image/upload/t_cover_big/co1l81.jpg,https://www.youtube.com/watch?v=W6u5N2mV6sI
787,Maquette,1.5,0.0,2.78,3.57,0.0,1.5,5.0,0.0,1.72,"MAQUETTE is a first-person recursive puzzle game that takes you into a world where every building, plant, and object are simultaneously tiny and staggeringly huge.",70.71236359087916,"['Puzzle', 'Adventure', 'Indie']","['PC (Microsoft Windows)', 'PlayStation 4', 'Xbox One', 'Nintendo Switch', 'PlayStation 5', 'Xbox Series X|S']","['Annapurna Interactive', 'Graceful Decay', '24 Bit Games']",//images.igdb.com/igdb/image/upload/t_cover_big/co21zz.jpg,https://www.youtube.com/watch?v=H5mj4CP4_rI
788,Mario & Sonic at the Olympic Games,0.0,2.5,0.56,0.71,1.43,0.5,2.5,0.0,0.57,"In this DS adaptation of the Wii title, Sega and Nintendo's characters appear in the same game for the first time in history. At the same time, this title uses the official Beijing 2008 Olympic Games license and features the official venues and environments of the 2008 Olympic Games. Mario, Luigi, Peach, and friends go head to head with Sonic, Tails, Knuckles, and their group in a sports competition through various Olympic events. Each character has different sets of attributes; these attributes give certain characters a slight advantage over others in particular events.",63.62471508566099,['Sport'],['Nintendo DS'],"['Nintendo', 'Sega', 'Sega Sports R&D']",//images.igdb.com/igdb/image/upload/t_cover_big/co22wf.jpg,https://www.youtube.com/watch?v=Cs9cQ9AJUd0
789,Mario + Rabbids: Kingdom Battle,1.75,5.0,2.22,4.29,0.71,2.5,2.5,0.0,2.13,,,,,,,
790,Mario + Rabbids: Sparks of Hope,1.5,7.5,2.22,3.57,2.86,2.0,5.0,0.0,2.3,,,,,,,
791,Mario Golf: Super Rush,0.5,0.0,0.56,1.43,0.0,0.0,0.0,0.0,0.41,"Tee off with family and friends in the biggest Mario Golf game yet! Hit the green with up to four players locally or online and golf with familiar Mushroom Kingdom characters. Modes range from Standard Golf to the energetic Speed Golf and an RPG-like golf adventure in story mode. Intuitive motion or button controls, a shot gauge that adapts to the curve of the course, and other new features make it easy for both new players and seasoned pros to drive and putt with power.",69.9695139784609,"['Role-playing (RPG)', 'Sport', 'Adventure']",['Nintendo Switch'],"['Camelot Software Planning', 'Nintendo', 'Camelot']",//images.igdb.com/igdb/image/upload/t_cover_big/co2urz.jpg,https://www.youtube.com/watch?v=PSM9KNgqAPE
792,Mario Kart 8 Deluxe,2.25,5.0,3.33,1.43,1.43,1.0,7.5,1.25,2.21,"Hit the road with the definitive version of Mario Kart 8 and play anytime, anywhere! Race your friends or battle them in a revised battle mode on new and returning battle courses. Play locally in up to 4-player multiplayer in 1080p while playing in TV Mode. Every track from the Wii U version, including DLC, makes a glorious return. Plus, the Inklings appear as all-new guest characters, along with returning favorites, such as King Boo, Dry Bones, and Bowser Jr.!",84.41350049386587,"['Racing', 'Arcade']",['Nintendo Switch'],"['Nintendo', 'Nintendo EPD Production Group No. 7']",//images.igdb.com/igdb/image/upload/t_cover_big/co213p.jpg,https://www.youtube.com/watch?v=ZKB9FEXhJ68
793,Mario Kart Live: Home Circuit,0.5,7.5,2.78,3.57,2.86,1.5,5.0,0.0,1.97,"Turn your home into a race track with Mario Kart Live: Home Circuit, a brand new way to experience Mario Kart on Nintendo Switch!

Drive a kart in the real world using familiar Mario Kart controls and see the action from your kart’s on-board camera displayed on your Nintendo Switch or TV screen. Watch as your home is transformed into ocean depths, a sandy desert and more from the world of Mario Kart!",,['Racing'],['Nintendo Switch'],"['Velan Studios', 'Nintendo']",//images.igdb.com/igdb/image/upload/t_cover_big/co2fuw.jpg,https://www.youtube.com/watch?v=TRvRdIuHyvc
794,Mario Party,0.0,0.0,0.56,0.0,0.0,0.0,0.0,0.0,0.08,"Every game in the main series has a standard Party Mode in which up to four players play through a board, trying to collect as many stars as possible. In every turn, each player rolls a die and progresses on the board, which usually has branching paths. Coins are primarily earned by performing well in a minigame played at the end of each turn. On most boards, players earn stars by reaching a star space and purchasing a star for a certain amount of coins. The star space appears randomly on one of several pre-determined locations and moves every time a star is purchased, usually occupying a blue space.
Every Mario Party contains at least 50 to almost 110 minigames with a few different types. Four-player games are a free-for-all in which players compete individually. In 2-on-2 and 1-on-3 minigames, players compete as two groups, cooperating to win, even though they are still competing individually in the main game. Some minigames in Mario Party are 4-player co-op, even though it doesn't say it. In most situations, winners earn ten coins each.",81.41277290369794,"['Quiz/Trivia', 'Card & Board Game']",['Nintendo 64'],"['Hudson Soft', 'Nintendo', 'CAProductions', 'Gradiente']",//images.igdb.com/igdb/image/upload/t_cover_big/co22qr.jpg,https://www.youtube.com/watch?v=e8G5Aj8dMpk
795,Mario Strikers Battle League,0.25,5.0,0.56,0.71,0.71,0.5,5.0,0.0,0.74,,,,,,,
796,Mario Tennis Aces,0.5,5.0,2.78,3.57,0.71,0.5,2.5,1.25,1.48,"A new Mario Tennis game is bringing a new level of skill and competition to Nintendo Switch. Mario steps onto the court in classy tennis garb for intense rallies against a variety of characters in full-blown tennis battles. New wrinkles in tennis gameplay will challenge your ability to read an opponent's position and stroke to determine which shot will give you the advantage. And this time the game adds the first story mode since the Mario Tennis game on Game Boy Advance, offering a new flavor of tennis gameplay, with a variety of missions, boss battles and more",71.22611953372842,"['Sport', 'Adventure']",['Nintendo Switch'],"['Nintendo', 'Camelot Software Planning', 'Camelot']",//images.igdb.com/igdb/image/upload/t_cover_big/co1tfw.jpg,https://www.youtube.com/watch?v=mMHT2vdWvpg
797,Mario vs. Donkey Kong,1.25,5.0,2.22,2.14,3.57,2.0,2.5,0.0,1.97,"A remake of the first game in the Mario vs. Donkey Kong series, originally released for the Game Boy Advance. In this puzzle-platformer, the player controls Mario in a quest to recover the Mini Marios kidnapped by his eternal rival, Donkey Kong.

Run, jump, and backflip your way to rescuing the stolen Mini-Mario toys in this puzzling twist on Mario action. Obstacles like spikes, moving platforms, and falling bricks stand in your way—put your brain to work and figure out the best way to reach the Mini-Marios.",68.85102398392873,"['Platform', 'Puzzle']",['Nintendo Switch'],"['Nintendo', 'Nintendo Software Technology']",//images.igdb.com/igdb/image/upload/t_cover_big/co8eak.jpg,https://www.youtube.com/watch?v=p_RypCfeXp4
798,Mars First Logistics,2.5,0.0,3.89,2.86,5.0,2.0,5.0,1.25,2.87,"Mars First Logistics is a physics-based open-world simulation game, where you design, build and control your own mechanical creations to deliver important cargo between colony stations on Mars. Earn credits, unlock new technology, upgrade your vehicle and tame the hostile Martian landscape.",,['Simulator'],['PC (Microsoft Windows)'],"['Shape Shop', 'Outersloth']",//images.igdb.com/igdb/image/upload/t_cover_big/co3npb.jpg,https://www.youtube.com/watch?v=6JIn1KIHLkY
