,Game,Controls,Difficulty,Getting Started,Reading,Navigation,Visual,Audio,Communication,Total,Summary,Rating,Genres,Platforms,Companies,Cover,Video
1182,Space Marauder,1.0,0.0,3.33,5.0,0.71,2.5,0.0,0.0,1.89,"When humankind discovers an alien race on a distant planet, it becomes clear that the extra-terrestrial way of life threatens survival on Earth. Rather than sending out a fleet of space destroyers or loads of nuclear warheads, it is determined that Earth's best chance of wiping out these creatures is (drum roll, please) you! As Space Marauder, it is your job to avoid waves of space beings careening through the outer reaches of the galaxy. You are aiding only by a jet pack and a laser gun. Sound tough? It is. Assorted power-ups are strewn about to help you in your plight, but the best asset you'll have is your itchy trigger finger and taste for alien blood. Lots of powerful bosses wait at the end of each of the game's levels, and every stage presents new and increasingly difficult challenges for our hero. Boasting a cool soundtrack and smooth controls, there's plenty of gameplay to keep your fingers moving for hours on end.",,['Shooter'],['Game Boy Color'],,//images.igdb.com/igdb/image/upload/t_cover_big/co2vga.jpg,
1183,Space Wave Race,0.75,5.0,1.67,4.29,1.43,4.5,2.5,0.0,2.13,Only the true heroes of space can become champions of Space Wave Race: the intergalactic championship that will take you to challenge the best pilots in the galaxy!,,"['Racing', 'Arcade']",['PC (Microsoft Windows)'],"['Associazione Audiogames', 'Rising Pixel', 'IV Productions']",//images.igdb.com/igdb/image/upload/t_cover_big/co41wl.jpg,
1184,Spaceteam,0.5,0.0,0.56,2.86,0.71,2.0,2.5,0.0,1.07,"A cooperative shouting game for phones and tablets
Do you like pushing buttons and shouting at your friends? Do you like discharging Clip-jawed Fluxtrunions? If you answered yes, or no, then you might have what it takes to be on a Spaceteam!

Features:

Teamwork
An untimely demise
Beveled Nanobuzzers
Auxiliary Technoprobes
Four-stroke Pluckers",70.08339267829561,"['Puzzle', 'Simulator', 'Indie']","['Android', 'iOS']",['Sleeping Beast Games'],//images.igdb.com/igdb/image/upload/t_cover_big/ngiojhhzbkd8jojw42id.jpg,https://www.youtube.com/watch?v=y3fsvKnIVJg
1185,Speed Crew,1.5,0.0,0.56,2.86,2.86,2.0,5.0,0.0,1.72,"A hilarious party game that focuses on chaotic cooperation between players. The task of the pit crew is to inspect arriving cars and perform quick repair services while navigating intricate levels. To succeed and beat their bitter rival, players must help each other and build tactics for each race.",,"['Racing', 'Simulator', 'Strategy', 'Indie', 'Arcade']","['PC (Microsoft Windows)', 'PlayStation 4', 'Xbox One', 'Nintendo Switch', 'PlayStation 5', 'Xbox Series X|S']",['Wild Fields'],//images.igdb.com/igdb/image/upload/t_cover_big/co6bbo.jpg,https://www.youtube.com/watch?v=IXCl_QmFMxo
1186,Spellbreak,2.0,0.0,0.56,0.71,2.14,2.0,7.5,3.75,1.89,"Spellbreak is an epic fantasy action-spellcasting game where players fight to become an all-powerful battlemage. Weave spectacular spell combinations, craft strategic builds, and master your environment as you dominate the Hollow Lands solo or with friends in a non-stop quest for survival.

The servers are currently shut down, but the developers have generously released a PC standalone version that allows you to host community servers or play offline.",68.67617019893204,"['Shooter', 'Role-playing (RPG)', 'Adventure']","['PC (Microsoft Windows)', 'PlayStation 4', 'Xbox One', 'Nintendo Switch', 'PlayStation 5', 'Xbox Series X|S']","['Proletariat, Inc.']",//images.igdb.com/igdb/image/upload/t_cover_big/co2nwn.jpg,
1187,SpiderHeck,0.75,0.0,1.67,2.86,1.43,2.0,5.0,1.25,1.56,"A physics-based spider murder simulator. Multiple spiders enter only one spider leaves.

Fight through a rapid progression of levels using various deadly weapons and environmental hazards to murder your friends and loved ones.",,"['Fighting', 'Platform', 'Indie', 'Arcade']","['PC (Microsoft Windows)', 'PlayStation 4', 'Xbox One', 'Nintendo Switch', 'PlayStation 5', 'Xbox Series X|S']",['Neverjam'],//images.igdb.com/igdb/image/upload/t_cover_big/co2fcb.jpg,https://www.youtube.com/watch?v=wdDEZXKgk7I
1188,Spilled,1.75,0.0,3.33,2.14,2.86,1.5,5.0,1.25,2.13,,,,,,,
1189,Spin Rhythm XD,2.0,5.0,2.78,2.14,2.14,2.5,7.5,0.0,2.38,"Enter the Rhythm Dimension! A homage to classic arcade rhythm games, with a modern aesthetic and soundtrack. Match colours and beats, spin, tap, flick and flow through the juiciest beats in the universe. Supports multiple control styles including Midi DJ gear on Steam!",75.78059471579255,"['Music', 'Indie', 'Arcade']","['PC (Microsoft Windows)', 'Nintendo Switch', 'PlayStation 5', 'PlayStation VR2']",['Super Spin Digital'],//images.igdb.com/igdb/image/upload/t_cover_big/co69h1.jpg,https://www.youtube.com/watch?v=RD0XaBqz2so
1190,Spinfrog: All aboard the Frogcopter,1.0,0.0,2.22,2.14,3.57,2.0,5.0,0.0,1.8,,,,,,,
1191,Spirit City: Lofi Sessions,1.0,0.0,2.22,2.86,0.0,3.0,5.0,0.0,1.64,"Study, relax, or get productive in the cozy world of Spirit City. Set the mood with lofi beats and soundscapes, customize your character and spirit pet, and use the productivity tools to help you stay on task. All while discovering cute hidden spirits and adding them to your spirit collection.",,"['Point-and-click', 'Simulator', 'Indie']",['PC (Microsoft Windows)'],['Mooncube Games'],//images.igdb.com/igdb/image/upload/t_cover_big/co6zee.jpg,https://www.youtube.com/watch?v=De-KMSl583A
1192,Spiritfarer,2.0,0.0,3.33,2.86,3.57,3.5,5.0,0.0,2.62,"Spiritfarer is a cozy management game about dying. You play Stella, ferrymaster to the deceased, a Spiritfarer. Build a boat to explore the world, then befriend and care for spirits before finally releasing them into the afterlife. Farm, mine, fish, harvest, cook, and craft your way across mystical seas. Join the adventure as Daffodil the cat, in two-player cooperative play. Spend relaxing quality time with your spirit passengers, create lasting memories, and, ultimately, learn how to say goodbye to your cherished friends. What will you leave behind?",86.36801196114483,"['Platform', 'Simulator', 'Adventure', 'Indie']","['Linux', 'PC (Microsoft Windows)', 'Mac', 'PlayStation 4', 'Xbox One', 'Nintendo Switch', 'Google Stadia']",['Thunder Lotus'],//images.igdb.com/igdb/image/upload/t_cover_big/co2fe7.jpg,https://www.youtube.com/watch?v=t-NmNCRDcc0
1193,Spitkiss,1.25,0.0,2.22,2.14,0.71,4.0,5.0,0.0,1.89,"Spitkiss is a trippy story of boundless and unconventional love, told through precision platforming.You play as the spitkissers, sending messages of love and hope back and forth the only way you can: precisely navigating spitballs through a variety of carefully crafted platforming stages. For those truly dedicated to the cause of love there will be extra challenges and additional ways to play each level.

The game includes themes of polyamory and genderfluid/non-binary identities on two layers. One story takes place in the metanarrative of the spitkissers, the other in the hand-drawn story of the life of Ymer, the person whose body their story takes place inside.

Featuring 80 levels with many hidden extras and replayable modes on release.",70.0,"['Platform', 'Indie']","['PC (Microsoft Windows)', 'Android', 'iOS']","['Triple Topping', 'Dear Villagers']",//images.igdb.com/igdb/image/upload/t_cover_big/co296h.jpg,https://www.youtube.com/watch?v=Wp4QTnlRVyM
1194,Spitlings,0.5,0.0,0.56,0.71,0.0,0.0,0.0,0.0,0.33,"Spitlings is a cute but hardcore Arcade game that’s made for playing locally with friends. Over hundred levels to start with and an easy-to-learn level editor will make sure, you never run out of challenges. Keep playing to unlock new music tracks, new characters to play with and new visual themes for certain levels. With the level editor, players can first build a level together and play it right afterwards. The multiplayer is cooperative to the last extend: If one player fails, everyone has to restart the level. Prepare for a lot of shouting.",,"['Platform', 'Indie', 'Arcade']","['PC (Microsoft Windows)', 'PlayStation 4', 'Xbox One', 'Nintendo Switch', 'Google Stadia']","['Massive Miniteam', 'HandyGames']",//images.igdb.com/igdb/image/upload/t_cover_big/co2era.jpg,https://www.youtube.com/watch?v=R6MkkIYZAjA
1195,Splasher,0.75,0.0,1.11,2.86,2.14,1.5,5.0,0.0,1.39,"Splasher is a 2D platformer that offers arcade action. With a powerful and surprising paint canon the player will have to face great challenges and use all his skills to rescue the Splashers. These little fellows are working as peons in a big factory, Inkorp. The Evil ruler of the company, Le Docteur, has insane plans that threatens them all with a terrible fate.

Along his journey, the player will have to master the power of his paint cannon. He will soon find out that each color offers special abilities, from crazy bouncing to sticking to walls, or even tricking encounters and changing their behaviour. The game will offer more than twenty levels, a time attack mode with leaderboards, epic boss fights and many other cool features.",63.23515938415939,"['Shooter', 'Platform', 'Indie', 'Arcade']","['Linux', 'PC (Microsoft Windows)', 'Mac', 'PlayStation 4', 'Xbox One', 'Nintendo Switch']","['Plug In Digital', 'The Sidekicks', 'Splashteam', 'Dear Villagers']",//images.igdb.com/igdb/image/upload/t_cover_big/co1z3z.jpg,https://www.youtube.com/watch?v=JUMaL4kN3pA
1196,Splatoon 3,1.25,0.0,1.67,3.57,1.43,2.5,7.5,1.25,1.97,"Enter the Splatlands, a sun-scorched desert inhabited by battle-hardened Inklings and Octolings. Splatsville, the city of chaos, is the adrenaline-fueled heart of this dusty wasteland. Even in this desolate environment, Turf War reigns supreme and battles rage in new stages located in the surrounding wilds. Dynamic new moves help these fighters dodge attacks and cover more ground, along with a new bow-shaped weapon to sling ink.",82.09048722089916,"['Shooter', 'Platform']",['Nintendo Switch'],['Nintendo'],//images.igdb.com/igdb/image/upload/t_cover_big/co59x3.jpg,https://www.youtube.com/watch?v=Rkz-PjCQjWk
1197,Splatty's Adventure,1.5,0.0,2.22,3.57,5.0,3.0,7.5,0.0,2.54,,,,,,,
1198,Splitgate Arena Warfare,2.5,0.0,2.78,1.43,1.43,1.5,5.0,3.75,2.21,,,,,,,
1199,SpongeBob SquarePants: Battle for Bikini Bottom,0.5,0.0,0.56,2.86,0.0,0.0,2.5,0.0,0.66,,,,,,,
1200,Spooky Chase,1.0,0.0,0.56,2.14,0.0,1.5,2.5,0.0,0.98,"A pixel art, arcade, platformer, challenging game where the enemies are generated by the player.",,"['Platform', 'Puzzle', 'Adventure', 'Indie', 'Arcade']","['PC (Microsoft Windows)', 'PlayStation 4', 'Xbox One', 'Nintendo Switch']","['Burning Goat', 'QUByte Interactive']",//images.igdb.com/igdb/image/upload/t_cover_big/co2elh.jpg,https://www.youtube.com/watch?v=GOLzGx71nag
1201,Spyro Reignited Trilogy,1.0,0.0,1.67,4.29,2.86,1.5,0.0,0.0,1.64,"Spyro Reignited Trilogy is a collection of remasters of the first three games in the Spyro series: Spyro the Dragon (1998), Ripto's Rage! (1999), and Year of the Dragon (2000).",83.2894944086467,"['Platform', 'Adventure']","['PC (Microsoft Windows)', 'PlayStation 4', 'Xbox One', 'Nintendo Switch']","['Toys for Bob', 'Activision', 'Iron Galaxy Studios']",//images.igdb.com/igdb/image/upload/t_cover_big/co1tjo.jpg,https://www.youtube.com/watch?v=mRc2MHS6owQ
1202,Squad,0.0,0.0,0.0,0.0,0.0,0.0,0.0,1.25,0.08,"Squad is a large scale combined arms multiplayer first-person shooter emphasizing combat realism through communication, team play, emphasizing strong squad cohesion mechanics as well as larger-scale coordination, tactics, and planning. It features 20 large open maps, vehicle-based combined arms gameplay, and player-constructed bases to create a heart-thumping, visceral gaming experience with split-second decision-making in real-world scale firefights.",82.2139297289595,"['Shooter', 'Simulator', 'Strategy', 'Tactical', 'Indie']",['PC (Microsoft Windows)'],['Offworld Industries'],//images.igdb.com/igdb/image/upload/t_cover_big/co84hg.jpg,https://www.youtube.com/watch?v=TjITHPQsGQ0
1203,Stacklands,1.0,2.5,1.11,2.86,0.71,3.5,0.0,0.0,1.56,"Stacklands is a village builder where you stack cards to collect food, build structures, and fight creatures.",79.06635439278554,"['Simulator', 'Strategy', 'Indie', 'Card & Board Game']","['PC (Microsoft Windows)', 'Mac', 'Nintendo Switch']",['Sokpop Collective'],//images.igdb.com/igdb/image/upload/t_cover_big/co4rpb.jpg,https://www.youtube.com/watch?v=VaR6R5FuwNg
1204,Star Stuff,2.0,0.0,5.0,2.86,4.29,4.0,7.5,0.0,3.11,"Star Stuff is a puzzle automation game that mixes bot programming with real time shenanigans. Play as Mija (me-ha), a cosmic employee on their first day at a star factory. Automate bots, interact in real time with bot actions to solve mind-bending puzzles, and save the ever-expanding universe while you're at it!",,"['Puzzle', 'Strategy', 'Adventure', 'Indie']","['PC (Microsoft Windows)', 'Mac']",['Animo Games Studio'],//images.igdb.com/igdb/image/upload/t_cover_big/co6eps.jpg,https://www.youtube.com/watch?v=CCb8q_m2J6U
1205,Star Trek Prodigy: Supernova,2.25,0.0,3.33,3.57,2.86,1.0,0.0,0.0,2.13,"After the U.S.S. Protostar picks up strange readings from a dying star, Dal and Gwyn must race against time to save their friends, their ship, and an entire planetary system before a supernova destroys them all! Using their unique skills to overcome ingenious puzzles, endure hostile environments and battle deadly robot armies, Dal and Gwyn must save their captured crewmates Jankom Pog, Rok-Tahk, Zero, and Murf. But they soon encounter a deadly new enemy, one that will stop at nothing to destroy the U.S.S. Protostar and change the very course of history!",,"['Platform', 'Puzzle', 'Adventure']","['PC (Microsoft Windows)', 'PlayStation 4', 'Xbox One', 'Nintendo Switch', 'PlayStation 5', 'Xbox Series X|S']","['Outright Games', 'Tessera Studios']",//images.igdb.com/igdb/image/upload/t_cover_big/co5375.jpg,https://www.youtube.com/watch?v=0KgQpVtEj5M
1206,Star Wars Battlefront II,0.0,2.5,0.0,0.0,0.0,0.0,0.0,0.0,0.08,"Embark on an endless Star Wars action experience from the best-selling Star Wars HD video game franchise of all time. Experience rich multiplayer battlegrounds across all 3 eras - prequel, classic and new trilogy - or rise as a new hero and discover an emotionally gripping single-player story spanning thirty years.

Customise and upgrade your heroes, starfighters or troopers - each with unique abilities to exploit in battle. Ride tauntauns or take control of tanks and speeders. Use the Force to prove your worth against iconic characters like Kylo Ren, Darth Maul or Han Solo, as you play a part in a gaming experience inspired by forty years of timeless Star Wars films.",69.80078839798696,"['Shooter', 'Adventure']","['PC (Microsoft Windows)', 'PlayStation 4', 'Xbox One']","['EA Digital Illusions CE', 'Criterion Games', 'Electronic Arts', 'Motive Studios']",//images.igdb.com/igdb/image/upload/t_cover_big/co3wi7.jpg,https://www.youtube.com/watch?v=Kae-JjbLsgA
1207,Star Wars Jedi: Fallen Order,2.5,5.0,1.67,4.29,3.57,1.5,7.5,0.0,2.62,"Star Wars Jedi: Fallen Order is a narratively driven, single-player game puts you in the role of a Jedi Padawan who narrowly escaped the purge of Order 66 following the events of Episode III: Revenge of the Sith. On a quest to rebuild the Jedi Order, you must pick up the pieces of your shattered past to complete your training, develop new powerful Force abilities and master the art of the iconic lightsaber - all while staying one step ahead of the Empire and its deadly Inquisitors.",80.90292955832425,['Adventure'],"['PC (Microsoft Windows)', 'PlayStation 4', 'Xbox One', 'PlayStation 5', 'Xbox Series X|S', 'Google Stadia']","['Respawn Entertainment', 'Panic Button Games', 'Electronic Arts']",//images.igdb.com/igdb/image/upload/t_cover_big/co1rbi.jpg,https://www.youtube.com/watch?v=0GLbwkfhYZk
1208,Star Wars Jedi: Survivor,2.5,7.5,3.89,4.29,4.29,3.0,10.0,0.0,3.44,"The story of Cal Kestis continues in Star Wars Jedi: Survivor, a third-person, galaxy-spanning, action-adventure game from Respawn Entertainment, developed in collaboration with Lucasfilm Games. This narratively driven, single-player title picks up five years after the events of Star Wars Jedi: Fallen Order and follows Cal’s increasingly desperate fight as the galaxy descends further into darkness. Pushed to the edges of the galaxy by the Empire, Cal will find himself surrounded by threats new and familiar. As one of the last surviving Jedi Knights, Cal is driven to make a stand during the galaxy’s darkest times — but how far is he willing to go to protect himself, his crew, and the legacy of the Jedi Order?",82.86073816917795,['Adventure'],"['PC (Microsoft Windows)', 'PlayStation 5', 'Xbox Series X|S']","['Respawn Entertainment', 'Electronic Arts']",//images.igdb.com/igdb/image/upload/t_cover_big/co5uzk.jpg,https://www.youtube.com/watch?v=bmj3ty-Wt48
1209,Star Wars: Bounty Hunter,0.25,0.0,1.67,2.14,0.0,0.5,5.0,0.0,0.82,"Star Wars: Bounty Hunter (released in Japan as Star Wars: Jango Fett) is a Star Wars video game developed and published by LucasArts for the GameCube and Sony PlayStation 2, released in 2002. In the game, players play as the bounty hunter Jango Fett, featured in the 2002 film Star Wars Episode II: Attack of the Clones, to which this game serves as a prequel. Both Temuera Morrison and Leeanna Walsman reprise their roles from the film as Jango Fett and Zam Wesell, respectively.

The main objective of Star Wars: Bounty Hunter is to hunt Dark Jedi Komari Vosa. During the game, it is revealed why Jango Fett was chosen as the template for the Grand Army of the Republic, how Boba Fett, his cloned ""son"" was born, and how Jango acquired Slave I.

Players also fight many ""bosses"", such as Montross and Longo ""Two-Guns"". There are also side objectives, such as collecting secondary bounties, that open special bonus items in the game. When the player beats a chapter, blooper reels - comedic machinima productions - are unlocked.",66.4414879988134,"['Shooter', 'Platform', 'Adventure']","['PlayStation 2', 'PlayStation 3', 'Nintendo GameCube', 'PlayStation 4']",['LucasArts'],//images.igdb.com/igdb/image/upload/t_cover_big/co56lf.jpg,https://www.youtube.com/watch?v=XBO0t6oI-iw
1210,Star Wars: Knights of the Old Republic,0.5,0.0,2.22,2.86,0.0,0.0,0.0,0.0,0.82,"Choose Your Path! Set 4,000 years before the Galactic Empire, you are the last hope for the Jedi Order and the Republic - can you master the ways of the Force to become their savior? Or will you fall to the dark side and achieve ultimate power? Hero, villain, peacekeeper, or chaos-bringer... you and your party will determine the fate of the galaxy!

Star Wars: Knights of the Old Republic is a role-playing video game. Players will be able to create their own characters and be able to choose what gender, appearance, class, skills, attributes, and feats they have throughout the game - no two characters will be the same!",90.54339862164375,"['Role-playing (RPG)', 'Adventure']","['PC (Microsoft Windows)', 'Xbox', 'Mac', 'Android', 'iOS', 'Nintendo Switch']","['BioWare', 'LucasArts', 'Activision', 'Aspyr Media']",//images.igdb.com/igdb/image/upload/t_cover_big/co1tmz.jpg,https://www.youtube.com/watch?v=_D_v1jMzFj4
1211,Star Wars: Republic Commando,2.0,5.0,1.67,3.57,3.57,1.5,2.5,0.0,2.21,"Chaos has erupted throughout the galaxy. As a leader of an elite squad of Republic Commandos, your mission is to infiltrate, dominate, and ultimately, annihalate the enemy. Your squad will follow your orders and your lead, working together as a team-instinctively, intelligently, instantly. You are their leader. They are your weapon.

Star Wars: Republic Commando is a tactical first-person shooter video game, set in the Star Wars universe. It was developed by LucasArts using the Unreal Engine, and published for the Xbox and Microsoft Windows in 2005. The game features both single-player and multiplayer game modes. In the story, set in the Star Wars Legends expanded universe, players assume the role of RC-1138 (""Boss""), an elite clone trooper, known as ""clone commando"", and the leader of the special ops unit Delta Squad, consisting of three fellow clone commandos with distinctive personalities and character traits: RC-1262 (""Scorch""), RC-1140 (""Fixer""), and RC-1207 (""Sev""). The story follows Delta Squad as they complete increasingly difficult missions throughout the Clone Wars and learn to bond as a team.

Republic Commando received generally favorable reviews at release. Many critics praised the story and combat, but criticized the short length and average multiplayer. In the years since its release, it has come to be considered one of the best Star Wars games ever made, and has gained a cult following.

An enhanced port of the game by Aspyr is set to release for the Nintendo Switch and PlayStation 4 on April 6, 2021. As reported by Jordan Ramée of GameSpot, ""Handled by Aspyr Media, Star Wars: Republic Commando Remastered brings the original 2005 Xbox and PC game to PS4 and Switch with enhanced HD graphics and modernized controls, though the multiplayer is absent. Otherwise, it's the same game. And though the flaws in its gameplay are only more noticeable now 16 years later, this remaster manages to still deliver a compelling story of four specialized commandos engaging in a variety of combat missions across the Clone Wars."".",82.18797495204768,"['Shooter', 'Tactical', 'Adventure']","['PC (Microsoft Windows)', 'Xbox', 'PlayStation 4', 'Nintendo Switch']","['LucasArts', 'Activision', 'Electronic Arts', 'Aspyr Media']",//images.igdb.com/igdb/image/upload/t_cover_big/co2au4.jpg,https://www.youtube.com/watch?v=dHuI7S1-Xpo
1212,Star Wars: Squadrons,1.5,5.0,1.11,4.29,3.57,2.5,10.0,6.25,2.87,"Master the art of starfighter combat in the authentic piloting experience STAR WARS: Squadrons. Buckle up, feel the adrenaline of first-person multiplayer space dogfights alongside your squadron, and learn what it means to be a pilot in a thrilling STAR WARS single-player campaign.",70.25468633273124,"['Shooter', 'Simulator']","['PC (Microsoft Windows)', 'PlayStation 4', 'Xbox One', 'Windows Mixed Reality', 'SteamVR', 'PlayStation VR', 'Oculus Rift']","['Electronic Arts', 'Motive Studios']",//images.igdb.com/igdb/image/upload/t_cover_big/co3wlz.jpg,https://www.youtube.com/watch?v=DeS7qgFjDUE
1213,Star Wars: The Force Unleashed,2.5,0.0,1.11,3.57,3.57,1.5,5.0,0.0,2.21,"Star Wars: The Force Unleashed is a Star Wars video game that takes place between the films Star Wars: Episode III Revenge of the Sith and Star Wars: Episode IV A New Hope. It is the centerpiece of the Star Wars: The Force Unleashed multimedia project,

Star Wars: The Force Unleashed completely re-imagines the scope and scale of the Force and casts players as Darth Vader’s ""Secret Apprentice,"" unveiling new revelations about the Star Wars galaxy seen through the eyes of a mysterious new character armed with unprecedented powers.",,"['Role-playing (RPG)', ""Hack and slash/Beat 'em up"", 'Adventure']",['Nintendo Switch'],,//images.igdb.com/igdb/image/upload/t_cover_big/co5au4.jpg,https://www.youtube.com/watch?v=v7fUzL_QtL0
1214,Star Wars: The Old Republic,0.75,5.0,2.22,4.29,5.71,2.0,7.5,2.5,2.62,"Step in to the center of your own Star Wars story as you choose your path down the light or dark side of the Force. Your choices have impact not only on your story but on those who join you along the way. Each choice you make can change how your story unfolds including unexpected story twists or devastating consequences that impact you and your Companions. Play as one of 8 legendary Star Wars classes include Jedi, Sith, Smuggler, Trooper and more – this is your story and you decide how you want to build your reputation and influence across the galaxy as you join in epic adventures and challenging missions on the ground and in space!",75.90516723410363,['Role-playing (RPG)'],['PC (Microsoft Windows)'],"['Electronic Arts', 'LucasArts', 'BioWare Austin', 'BioWare Edmonton']",//images.igdb.com/igdb/image/upload/t_cover_big/co20xa.jpg,https://www.youtube.com/watch?v=AQ-p5k8T6Jw
1215,StarVaders,0.75,2.5,1.67,2.86,2.14,2.0,5.0,0.0,1.64,Mecha roguelike-deckbuilding tactical shoot-em-up! Upgrade your deck with impactful cards and master the quick and crunchy turn-based tactics to save the future of humanity in Star Vaders!,,"['Strategy', 'Indie']",['PC (Microsoft Windows)'],['StarVaders Team'],//images.igdb.com/igdb/image/upload/t_cover_big/co6thq.jpg,https://www.youtube.com/watch?v=CtuziM8rs98
1216,Stardew Valley,2.25,0.0,1.11,3.57,1.43,1.5,5.0,1.25,1.97,"Stardew Valley is an open-ended country-life RPG! You’ve inherited your grandfather’s old farm plot in Stardew Valley. Armed with hand-me-down tools and a few coins, you set out to begin your new life. Can you learn to live off the land and turn these overgrown fields into a thriving home? It won’t be easy. Ever since Joja Corporation came to town, the old ways of life have all but disappeared. The community center, once the town’s most vibrant hub of activity, now lies in shambles. But the valley seems full of opportunity. With a little dedication, you might just be the one to restore Stardew Valley to greatness!",86.93224197206513,"['Role-playing (RPG)', 'Simulator', 'Strategy', 'Indie']","['Linux', 'PC (Microsoft Windows)', 'Mac', 'Android', 'iOS', 'Wii U', 'PlayStation Vita', 'PlayStation 4', 'Xbox One', 'Nintendo Switch']","['Sickhead Games', 'Chucklefish Games', 'The Secret Police', 'ConcernedApe', 'Chucklefish Games']",//images.igdb.com/igdb/image/upload/t_cover_big/xrpmydnu9rpxvxfjkiu7.jpg,https://www.youtube.com/watch?v=8A7A1X1TVNc
